{
  "case_id": "V19-DEMO-001",
  "standard": "СП 16.13330.2017 «Стальные конструкции»",
  "action": "overhead_line_and_switchyard_supports",
  "section_16_applicability_confirmed": true,
  "structure_case": "GROUP_2_WELDED_VL_OR_HIGH_VOLTAGE_ORU_OR_KS_TENSION",
  "table_45_case_id": "FREE_STANDING_FIRST_TWO_PANELS_BOLTED_CHORD",
  "table_45_applied_to_node_connection": false,
  "length_mm": 12000.0,
  "chord_axis_spacing_mm": 2000.0,
  "height_mm": 30000.0,
  "upper_spacing_mm": 1000.0,
  "lower_spacing_mm": 3000.0,
  "moment_n_mm": 100000000.0,
  "axial_force_n": 1000000.0,
  "connection_beta": 1.2,
  "first_order_midspan_moment_n_mm": 80000000.0,
  "first_order_max_shear_n": 45000.0,
  "transverse_deflection_mm": 12.0,
  "area_mm2": 8000.0,
  "reduced_slenderness": 120.0,
  "elastic_modulus_n_mm2": 206000.0,
  "moment_x_n_mm": 100000000.0,
  "moment_y_n_mm": 50000000.0,
  "angle_member": "chord",
  "angle_connection": "bolted",
  "c_over_b": 0.6,
  "n_md_over_n_m": 0.3,
  "brace_bolt_line_ratio": 0.57,
  "figure_15_g_or_d": false,
  "welded_centering": "centroids",
  "broken_wire_combination": false,
  "table_46_row_id": "SWITCHYARD_SUPPORT_ALONG_WIRES",
  "table_46_measure": "top_deviation",
  "actual_relative_deformation": 0.008,
  "table_46_load_mode": "normal",
  "traverse_member": "chord_primary",
  "panel_length_mm": 3000.0,
  "alternate_chord_length_mm": 2500.0,
  "actual_first_lower_brace_slenderness": 140.0,
  "support_system": "free_standing",
  "actual_diaphragm_spacing_m": 20.0,
  "diaphragm_at_concentrated_loads": true,
  "diaphragm_at_chord_breaks": true,
  "edge_distance_mm": 40.0,
  "bolt_diameter_mm": 20.0,
  "permanently_tensioned_single_bolt_element": true,
  "braces_on_both_sides_of_chord_leg": true,
  "splice_total_bolts": 8,
  "splice_bolts_per_leg_each_side": 4,
  "splice_rows_per_leg_each_side": 4,
  "use_seven_bolt_exception": false,
  "polygonal_face_count": 10,
  "polygonal_face_width_mm": 500.0,
  "polygonal_wall_thickness_mm": 10.0,
  "maximum_compressive_stress_n_mm2": 100.0,
  "minimum_stress_n_mm2": -20.0,
  "design_yield_resistance_n_mm2": 345.0,
  "working_condition_factor": 1.0,
  "external_loads_and_combinations_confirmed": true
}
